{
    "$schema": "https://raw.githubusercontent.com/Outsmart-OOH/ooh_open_direct/master/schema/v0/resources/accounts/account_request.json",
    "AdvertiserId": "1234987",
    "BuyerId": "34587",
    "ThirdPartyId": "98765",
    "Name": "Brand A",
    "Id": "abcd45",
    "ProviderData": "Some provider Data"
}